{
  "schema_version": 1,
  "content_version": 1,
  "cases": [
    {
      "id": "case_001",
      "description": "Placeholder case — mid-2016 window (fake, not a real event)",
      "start": "2016-03-01 00:00:00",
      "end": "2016-03-05 00:00:00",
      "tags": ["quiet"]
    },
    {
      "id": "case_002",
      "description": "Placeholder case — late-2019 window (fake, not a real event)",
      "start": "2019-10-10 00:00:00",
      "end": "2019-10-14 00:00:00",
      "tags": ["storm"]
    },
    {
      "id": "case_003",
      "description": "Placeholder case — mid-2022 window (fake, not a real event)",
      "start": "2022-06-15 00:00:00",
      "end": "2022-06-19 00:00:00",
      "tags": ["storm"],
      "data_refs": {
        "satellite_track": "placeholder_case_003_track.csv",
        "reference_density_csv": "placeholder_case_003_truth.csv"
      }
    },
    {
      "id": "case_004",
      "description": "Placeholder case — early-2025 window (fake, not a real event)",
      "start": "2025-02-01 00:00:00",
      "end": "2025-02-05 00:00:00",
      "tags": ["quiet"],
      "data_refs": {
        "satellite_track": "placeholder_case_004_track.csv",
        "reference_density_csv": "placeholder_case_004_truth.csv"
      }
    }
  ],
  "checks": [
    {
      "id": "check_001",
      "kind": "lonlat_density_plot",
      "params": { "altitudes_km": [200, 400, 600] }
    },
    {
      "id": "check_002",
      "kind": "rmse_timeseries",
      "applies_to": ["case_003", "case_004"],
      "params": {
        "truth_ref": "reference_density_csv",
        "variable": "density",
        "threshold": { "max": 5.0e-13 },
        "unit": "kg/m^3"
      }
    },
    {
      "id": "check_003",
      "kind": "satellite_lineout",
      "applies_to": ["case_003", "case_004"],
      "params": {
        "truth_ref": "satellite_track",
        "variable": "density",
        "unit": "kg/m^3"
      }
    }
  ]
}
